"value","nombre","usuario","fecha","retweets","like","replies","texto","hashtags","ctasMencionadas","nombres_propios","fecha2"
"WB Pictures Latam Verified account  @WBPicturesLatam 35m 35 minutes ago More La crítica definió a #Guasón como “fascinante” y “cautivadora”. ¿Tu cómo la definirías?  Reply 5 Retweet 7 Like 44","WB Pictures Latam Verified account  ","@WBPicturesLatam ","2019-10-05",7,44,5,"La crítica definió a #Guasón como “fascinante” y “cautivadora”. ¿Tu cómo la definirías?","#Guasón","","La, Guasón, Tu","2019-10-05"
"Pablo Rendón  @pagusrendon 2h 2 hours ago More EEUU  Joker  Italia  Burlone   México  Guasón  España El Bromas  Ciudad de México  El Cábulas Reply 13 Retweet 65 Like 517","Pablo Rendón  ","@pagusrendon ","2019-10-05",65,517,13,"EEUU  Joker  Italia  Burlone   México  Guasón  España El Bromas  Ciudad de México  El Cábulas","","","EEUU, Joker, Italia, Burlone, México, Guasón, España, El, Bromas, Ciudad, México, El, Cábulas","2019-10-05"
"nilfredo1978  @nilfredo1978 1h 1 hour ago More guaido y guason #GuasonGuaido Reply 2 Retweet 19 Like 12","nilfredo1978  ","@nilfredo1978 ","2019-10-05",19,12,2,"guaido y guason #GuasonGuaido","#GuasonGuaido","","GuasonGuaido","2019-10-05"
"El Universal Verified account  @El_Universal_Mx 40m 40 minutes ago More ¿""El Burlón"", ""El Bromas"" ? Reply 1 Retweet 8 Like 56","El Universal Verified account  ","@El_Universal_Mx ","2019-10-05",8,56,1,"¿""El Burlón"", ""El Bromas"" ?","","","El, Burlón, El, Bromas","2019-10-05"
"maria jose G.  @IrmaMor23 3h 3 hours ago More Quiero ir a ver la película del guason a ver si es la mejor de todas #GuasonGuaido Reply 3 Retweet 34 Like 32","maria jose G","@IrmaMor23 ","2019-10-05",34,32,3,".Quiero ir a ver la película del guason a ver si es la mejor de todas #GuasonGuaido","#GuasonGuaido","","Quiero, GuasonGuaido","2019-10-05"
"Guasónᴾʸ  @GuasonPy 1h 1 hour ago More Nada peor que insistir con alguien que sabes que no te elige. Reply Retweet 9 Like 12","Guasónᴾʸ  ","@GuasonPy ","2019-10-05",9,12,NA,"Nada peor que insistir con alguien que sabes que no te elige.","","","Nada","2019-10-05"
" 🃏 Tio Guason   🃏  @tioguason 8m 8 minutes ago More Yo, cada vez que Mauricio Cuero intenta burlar algún rival  pic.twitter.com/aWxUUwJHQy This media may contain sensitive material. Learn more View Reply Retweet 3 Like 15"," ","@tioguason ","2019-10-05",3,15,NA,"🃏 Tio Guason   🃏Yo, cada vez que Mauricio Cuero intenta burlar algún rival  pic.twitter.com/aWxUUwJHQy This media may contain sensitive material. Learn more View","","","Tio, Guason, Yo, Mauricio, Cuero, WxUUwJHQy, This, Learn, View","2019-10-05"
"Alvaro Rondon  @AlvaroRondon17 3h 3 hours ago More #GuasonGuaido me parece una falta de respeto total para el pobre guasón, un abuso la comparación, de verdad Reply 7 Retweet 24 Like 18","Alvaro Rondon  ","@AlvaroRondon17 ","2019-10-05",24,18,7,"#GuasonGuaido me parece una falta de respeto total para el pobre guasón, un abuso la comparación, de verdad","#GuasonGuaido","","GuasonGuaido","2019-10-05"
"Honor Y Gloria   ❤  @JoviNomas 2h 2 hours ago More  The Joker.  El Guasón.  El Bromas.  Piñera culiao. pic.twitter.com/y0bFLeWvEH Reply 4 Retweet 24 Like 70","Honor Y Gloria   ","@JoviNomas ","2019-10-05",24,70,4,"❤ The Joker.  El Guasón.  El Bromas.  Piñera culiao. pic.twitter.com/y0bFLeWvEH","","","The, Joker, El, Guasón, El, Bromas, Piñera, FLeWvEH","2019-10-05"
"nelio omar  @NelioOmar 3h 3 hours ago More Guaido interpretando la película del guason #GuasonGuaido Reply 4 Retweet 21 Like 15","nelio omar  ","@NelioOmar ","2019-10-05",21,15,4,"Guaido interpretando la película del guason #GuasonGuaido","#GuasonGuaido","","Guaido, GuasonGuaido","2019-10-05"
"KD  @elchamo211 3h 3 hours ago More #GuasonGuaido el guasón bebé Reply 1 Retweet 12 Like 11","KD  ","@elchamo211 ","2019-10-05",12,11,1,"#GuasonGuaido el guasón bebé","#GuasonGuaido","","GuasonGuaido","2019-10-05"
"El Espectador Verified account  @elespectador 1h 1 hour ago More #Del1Al5 ¿Cuál es la polémica que envuelve a la nueva película de Todd Phillips, #Guasón? https://www.elespectador.com/del-1-al-5/guason-cinco-datos-curiosos-de-la-pelicula-sin-spoilers-video-884205 … Reply 1 Retweet 5 Like 29","El Espectador Verified account  ","@elespectador ","2019-10-05",5,29,1,"#Del1Al5 ¿Cuál es la polémica que envuelve a la nueva película de Todd Phillips, #Guasón? https://www.elespectador.com/del-1-al-5/guason-cinco-datos-curiosos-de-la-pelicula-sin-spoilers-video-884205 …","#Del1Al5, #Guasón","","Del1Al5, Cuál, Todd, Phillips, Guasón","2019-10-05"
"Insurrecta   🌞 R  @InsurrectaR 1h 1 hour ago More Insurrecta R Retweeted Cristina LA MEJOR#TropaK El Guasón en cualquier momento pide pasaporte para entrar a CABA! Es un ghetto cheto...  Insurrecta R added, Cristina LA MEJOR#TropaK  @mejor_cristina Por esto y muchísimo más  #EsHoraDeLammens  Reply 1 Retweet 8 Like 10","Insurrecta   ","@InsurrectaR ","2019-10-05",8,10,1,"🌞Insurrecta R Retweeted Cristina LA MEJOR#TropaK El Guasón en cualquier momento pide pasaporte para entrar a CABA! Es un ghetto cheto...  Insurrecta R added, Cristina LA MEJOR#TropaK  @mejor_cristina Por esto y muchísimo más  #EsHoraDeLammens","#TropaK, #TropaK, #EsHoraDeLammens","@mejor_cristina","Insurrecta, Retweeted, Cristina, LA, MEJOR, TropaK, El, Guasón, CABA, Es, Insurrecta, Cristina, LA, MEJOR, TropaK, Por, EsHoraDeLammens","2019-10-05"
"Mati  🤘  @matias_andriol1 2h 2 hours ago More Alguien q quiera ir a ver el Guason por favor Reply 2 Retweet 8 Like 5","Mati  ","@matias_andriol1 ","2019-10-05",8,5,2,"🤘Alguien q quiera ir a ver el Guason por favor","","","Alguien, Guason","2019-10-05"
"Gen Mendez   💋  @DimeGen_ 2h 2 hours ago More El tipo tiene la misma maldad del guasón! Solo quiere destruir #GuasonGuaido Reply Retweet 15 Like 14","Gen Mendez   ","@DimeGen_ ","2019-10-05",15,14,NA,"💋El tipo tiene la misma maldad del guasón! Solo quiere destruir #GuasonGuaido","#GuasonGuaido","","El, Solo, GuasonGuaido","2019-10-05"
"DreamBriz2  @Briz2Dream 3h 3 hours ago More No le falten el respeto al guason vale #GuasonGuaido Reply 1 Retweet 15 Like 12","DreamBriz2  ","@Briz2Dream ","2019-10-05",15,12,1,"No le falten el respeto al guason vale #GuasonGuaido","#GuasonGuaido","","No, GuasonGuaido","2019-10-05"
"InconformeSiempre  @InconformeSiem1 3h 3 hours ago More El Guason en esta última película revela una faceta desconocida del personaje, más que ser un malo porque si, es una persona enferma... #GuasonGuaido Reply Retweet 12 Like 9","InconformeSiempre  ","@InconformeSiem1 ","2019-10-05",12,9,NA,"El Guason en esta última película revela una faceta desconocida del personaje, más que ser un malo porque si, es una persona enferma... #GuasonGuaido","#GuasonGuaido","","El, Guason, GuasonGuaido","2019-10-05"
"Giorgio Emiliani  @giomiliani 3h 3 hours ago More Giorgio Emiliani Retweeted Edu w Guasón viene de «guasa», que es broma o burla. Es una buena traducción, de hecho.  Giorgio Emiliani added, Edu   🎃 w  🎃  @edul3on Con qué moral nos vamos a burlar de la traducción española de Joker a ""El Bromas"" si en latam toda la vida se ha llamado ""El Guasón"".  Qué coño significa Guasón? Reply 2 Retweet 11 Like 25","Giorgio Emiliani  ","@giomiliani ","2019-10-05",11,25,2,"Giorgio Emiliani Retweeted Edu w Guasón viene de «guasa», que es broma o burla. Es una buena traducción, de hecho.  Giorgio Emiliani added, Edu   🎃 w  🎃  @edul3on Con qué moral nos vamos a burlar de la traducción española de Joker a ""El Bromas"" si en latam toda la vida se ha llamado ""El Guasón"".  Qué coño significa Guasón?","","@edul3on","Giorgio, Emiliani, Retweeted, Edu, Guasón, Es, Giorgio, Emiliani, Edu, Con, Joker, El, Bromas, El, Guasón, Qué, Guasón","2019-10-05"
"Ivana Morales  @IvanaaMoralesv 2h 2 hours ago More Que ofensa para el guason #GuasonGuaido Reply 1 Retweet 5 Like 5","Ivana Morales  ","@IvanaaMoralesv ","2019-10-05",5,5,1,"Que ofensa para el guason #GuasonGuaido","#GuasonGuaido","","Que, GuasonGuaido","2019-10-05"
"∆ Manuel ∆  @MonsterDroiid 2h 2 hours ago More Ando acá en el cine a punto de ver la del Guasón   Veamos que tal 7u7 de rato que llegue les cuento el chisme en directo jaja  Por cierto pasen a ver el video mas reciente en el canal principal con  noah y kael me cagué de risa grabándolo  xD Reply 21 Retweet 8 Like 128",NA,"@MonsterDroiid ","2019-10-05",8,128,21,"∆ Manuel ∆Ando acá en el cine a punto de ver la del Guasón   Veamos que tal 7u7 de rato que llegue les cuento el chisme en directo jaja  Por cierto pasen a ver el video mas reciente en el canal principal con  noah y kael me cagué de risa grabándolo  xD","","","Manuel, Ando, Guasón, Veamos, Por","2019-10-05"
"🅲  🅾 🅽🅽🅸🅴 Verified account  @connieansaldi 3h 3 hours ago More Totalmente en Shock con el Guason. Imposible no querer abrazarlo... Joaquín Ph es lo mejor que vi . Reply 7 Retweet 11 Like 275 Show this thread","🅲  🅾 🅽🅽🅸🅴 Verified account  ","@connieansaldi ","2019-10-05",11,275,7,"Totalmente en Shock con el Guason. Imposible no querer abrazarlo... Joaquín Ph es lo mejor que vi .    Show this thread","","","Totalmente, Shock, Guason, Imposible, Joaquín, Ph, Show","2019-10-05"
"🅲  🅾 🅽🅽🅸🅴 Verified account  @connieansaldi 2h 2 hours ago More El Guason no es para niños . Así que vayan dejándolos en casa . Reply 5 Retweet 9 Like 120 Show this thread","🅲  🅾 🅽🅽🅸🅴 Verified account  ","@connieansaldi ","2019-10-05",9,120,5,"El Guason no es para niños . Así que vayan dejándolos en casa .    Show this thread","","","El, Guason, Así, Show","2019-10-05"
"WB Pictures Latam Verified account  @WBPicturesLatam 2h 2 hours ago More Lista de tareas para este del fin de semana:  1) Ver #Guasón  2) Debatir la película con amigos, familiares, mascotas y vecinos.  Repite  Reply Retweet 17 Like 74","WB Pictures Latam Verified account  ","@WBPicturesLatam ","2019-10-05",17,74,NA,"Lista de tareas para este del fin de semana:  1) Ver #Guasón  2) Debatir la película con amigos, familiares, mascotas y vecinos.  Repite","#Guasón","","Lista, Ver, Guasón, Debatir, Repite","2019-10-05"
"Xgamer  @Xgamer32384933 3h 3 hours ago More El Guason en esta última película revela una faceta desconocida del personaje, más que ser un malo porque si, es una persona enferma... #GuasonGuaido Reply 2 Retweet 12 Like 8","Xgamer  ","@Xgamer32384933 ","2019-10-05",12,8,2,"El Guason en esta última película revela una faceta desconocida del personaje, más que ser un malo porque si, es una persona enferma... #GuasonGuaido","#GuasonGuaido","","El, Guason, GuasonGuaido","2019-10-05"
"XVzla-37X  @Xvzla3 43m 43 minutes ago More #GuasonGuaido ahora el guason, de Guaido van a seguir pasando TT hasta que salga de su cargo porque ya esté señor está rayado para burlarse de el Reply Retweet 8 Like 9","XVzla","@Xvzla3 ","2019-10-05",8,9,NA,"-#GuasonGuaido ahora el guason, de Guaido van a seguir pasando TT hasta que salga de su cargo porque ya esté señor está rayado para burlarse de el","#GuasonGuaido","","GuasonGuaido, Guaido, TT","2019-10-05"
"Javier Matuk Verified account  @jmatuk 2h 2 hours ago More Fui a ver el Guasón... ¿Te gustó? A mí ... ¿Qué crees?  Reply 27 Retweet 5 Like 74","Javier Matuk Verified account  ","@jmatuk ","2019-10-05",5,74,27,"Fui a ver el Guasón... ¿Te gustó? A mí ... ¿Qué crees?","","","Fui, Guasón, Te, Qué","2019-10-05"
"Su madre  @MojiconFuicioso 2h 2 hours ago More Ya quiero que llegue 31 de octubre para ver los 82 mil disfraces originales de El Guasón. Reply 2 Retweet 3 Like 26","Su madre  ","@MojiconFuicioso ","2019-10-05",3,26,2,"Ya quiero que llegue 31 de octubre para ver los 82 mil disfraces originales de El Guasón.","","","Ya, El, Guasón","2019-10-05"
"Esperanza  @Esperantacos 2h 2 hours ago More #GuasonGuaido rolo e pelicula q se monta este tipo el propio guason Reply Retweet 8 Like 3","Esperanza  ","@Esperantacos ","2019-10-05",8,3,NA,"#GuasonGuaido rolo e pelicula q se monta este tipo el propio guason","#GuasonGuaido","","GuasonGuaido","2019-10-05"
"Tomatazos Verified account  @TomatazosCom 2h 2 hours ago More Estas son las películas que debes ver antes de #Joker http://bit.ly/2p7M6lL  ¿Las habían visto antes? Reply Retweet 4 Like 12","Tomatazos Verified account  ","@TomatazosCom ","2019-10-05",4,12,NA,"Estas son las películas que debes ver antes de #Joker http://bit.ly/2p7M6lL  ¿Las habían visto antes?","#Joker","","Estas, Joker, M6lL, Las","2019-10-05"
"Gladys Valbuena  @GladysVal_23 2h 2 hours ago More no creo que Guaido sea guason #GuasonGuaido Reply 1 Retweet 5 Like 3","Gladys Valbuena  ","@GladysVal_23 ","2019-10-05",5,3,1,"no creo que Guaido sea guason #GuasonGuaido","#GuasonGuaido","","Guaido, GuasonGuaido","2019-10-05"
"Xgamer  @Xgamer32384933 2h 2 hours ago More #GuasonGuaido me parece una falta de respeto total para el pobre guasón, un abuso la comparación, de verdad Reply Retweet 5 Like 4","Xgamer  ","@Xgamer32384933 ","2019-10-05",5,4,NA,"#GuasonGuaido me parece una falta de respeto total para el pobre guasón, un abuso la comparación, de verdad","#GuasonGuaido","","GuasonGuaido","2019-10-05"
"doris  @doris23917024 1h 1 hour ago More #GuasonGuaido donde estas guason no te esconda Reply Retweet 10 Like 6","doris  ","@doris23917024 ","2019-10-05",10,6,NA,"#GuasonGuaido donde estas guason no te esconda","#GuasonGuaido","","GuasonGuaido","2019-10-05"
"El Espectador Verified account  @elespectador 25m 25 minutes ago More #LoMásLeído en Cultura: Jack Nicholson: Ser el Guasón (El juego del Joker). http://tinyurl.com/yytblgwn  Reply Retweet 4 Like 16","El Espectador Verified account  ","@elespectador ","2019-10-05",4,16,NA,"#LoMásLeído en Cultura: Jack Nicholson: Ser el Guasón (El juego del Joker). http://tinyurl.com/yytblgwn","#LoMásLeído","","LoMásLeído, Cultura, Jack, Nicholson, Ser, Guasón, El, Joker","2019-10-05"
"Frases y Chistes ツ  @BuenasPhrases 3h 3 hours ago More  Joker.  Guasón.  Las flipantes aventuras del bromas. Reply 1 Retweet 13 Like 27","Frases y Chistes ツ  ","@BuenasPhrases ","2019-10-05",13,27,1,"Joker.  Guasón.  Las flipantes aventuras del bromas.","","","Joker, Guasón, Las","2019-10-05"
"Anny Lee   ⚡  @Annyjps 2h 2 hours ago More El Guasón El Bromas  El Ratica El Chalequeador El Jodedorcito El Guachafita El echador de vaina  El mamador de gallo Reply 1 Retweet 5 Like 15","Anny Lee   ","@Annyjps ","2019-10-05",5,15,1,"⚡El Guasón El Bromas  El Ratica El Chalequeador El Jodedorcito El Guachafita El echador de vaina  El mamador de gallo","","","El, Guasón, El, Bromas, El, Ratica, El, Chalequeador, El, Jodedorcito, El, Guachafita, El, El","2019-10-05"
"Jose  @josejavierhsc 1h 1 hour ago More Replying to @lasheron vivimos en una sociedad donde pocos conocen al señor sarcasmo pero todos conocen al guason Reply 1 Retweet 5 Like 52","Jose  ","@josejavierhsc ","2019-10-05",5,52,NA,"REPLYING TO @lasheron vivimos en una sociedad donde pocos conocen al señor sarcasmo pero todos conocen al guason","","@lasheron","","2019-10-05"
"Clona   🇦🇷  ⏩  @clonazepunkk 2h 2 hours ago More En ecuador se cansaron de que los tomen por boludos. Aguante Guasón. Reply 2 Retweet 4 Like 24","Clona   ","@clonazepunkk ","2019-10-05",4,24,2,"🇦🇷  ⏩En ecuador se cansaron de que los tomen por boludos. Aguante Guasón.","","","En, Aguante, Guasón","2019-10-05"
"nelio omar  @NelioOmar 2h 2 hours ago More El guason diciendo El grinn(maduro) me tiene que pasar la parte del trato o sino alboroto la gente con que voy a sacarlo de esta crisis #GuasonGuaido Reply 1 Retweet 3 Like 1","nelio omar  ","@NelioOmar ","2019-10-05",3,1,1,"El guason diciendo El grinn(maduro) me tiene que pasar la parte del trato o sino alboroto la gente con que voy a sacarlo de esta crisis #GuasonGuaido","#GuasonGuaido","","El, El, GuasonGuaido","2019-10-05"
"Abel   🥞  @elciempies 2h 2 hours ago More El único guasón que me interesa es el guasón-tle Reply 3 Retweet 6 Like 56","Abel   ","@elciempies ","2019-10-05",6,56,3,"🥞El único guasón que me interesa es el guasón-tle","","","El","2019-10-05"
"Hugo Nestor Paredero  @hugoparedero 60m 60 minutes ago More Arthur Fleck es un tipo desolado, paciente psiquiátrico. Vive c/su madre (q lo llama Feliz), labura de guasón en calle y  hospitales, ríe sin reir, deberá matar. Inmenso laburo de Joaquin Phoenix en peli de Todd Phillips. Su desamparo es el nuestro, su locura también. Genial!  Reply 2 Retweet 4 Like 13","Hugo Nestor Paredero  ","@hugoparedero ","2019-10-05",4,13,2,"Arthur Fleck es un tipo desolado, paciente psiquiátrico. Vive c/su madre (q lo llama Feliz), labura de guasón en calle y  hospitales, ríe sin reir, deberá matar. Inmenso laburo de Joaquin Phoenix en peli de Todd Phillips. Su desamparo es el nuestro, su locura también. Genial!","","","Arthur, Fleck, Vive, Feliz, Inmenso, Joaquin, Phoenix, Todd, Phillips, Su, Genial","2019-10-05"
"Papa Pancho  @PontifexMundial 3m 3 minutes ago More Es neta que en España la película del Guason se llama ""El Bromas""  Reply Retweet 1 Like 6","Papa Pancho  ","@PontifexMundial ","2019-10-05",1,6,NA,"Es neta que en España la película del Guason se llama ""El Bromas""","","","Es, España, Guason, El, Bromas","2019-10-05"
"nilfredo1978  @nilfredo1978 2h 2 hours ago More Joaquín Phoenix se transforma magistralmente en ""Guasón"" la mejor actuaciòn #GuasonGuaido Reply Retweet 9 Like 4","nilfredo1978  ","@nilfredo1978 ","2019-10-05",9,4,NA,"Joaquín Phoenix se transforma magistralmente en ""Guasón"" la mejor actuaciòn #GuasonGuaido","#GuasonGuaido","","Joaquín, Phoenix, Guasón, GuasonGuaido","2019-10-05"
"XAVIER  @xavijativa 2h 2 hours ago More El baile en la escalera con esta canción  es magistral  https://youtu.be/t-hB1TzoG7M    #Joker #Guason   Reply 1 Retweet 2 Like 2","XAVIER  ","@xavijativa ","2019-10-05",2,2,1,"El baile en la escalera con esta canción  es magistral  https://youtu.be/t-hB1TzoG7M    #Joker #Guason","#Joker, #Guason","","El, B1TzoG7M, Joker, Guason","2019-10-05"
"Tigre de la Falacia☭  @OscarDelDiablo 1h 1 hour ago More –¿Ya viste la actuación del payaso siniestro del que todo el mundo habla? –¿It? –No, el otro. –¿El Guasón? –El otro. –¿Trump? –El otro... –Bolsonaro –Ese. Reply Retweet 10 Like 38","Tigre de la Falacia","@OscarDelDiablo ","2019-10-05",10,38,NA,"☭–¿Ya viste la actuación del payaso siniestro del que todo el mundo habla? –¿It? –No, el otro. –¿El Guasón? –El otro. –¿Trump? –El otro... –Bolsonaro –Ese.","","","Ya, It, No, El, Guasón, El, Trump, El, Bolsonaro, Ese","2019-10-05"
"lannister  @lizarjusti 1h 1 hour ago More - Joker - El Guasón - El Bromas - El Jaja - El XD Reply Retweet 4 Like 8","lannister  ","@lizarjusti ","2019-10-05",4,8,NA,"- Joker - El Guasón - El Bromas - El Jaja - El XD","","","Joker, El, Guasón, El, Bromas, El, Jaja, El, XD","2019-10-05"
"CinesArgentinos.com Verified account  @cinesargentinos 2h 2 hours ago More Dejá tu crítica de #Joker en https://www.cinesargentinos.com.ar/pelicula/7938-guason/ …  #Guasón  Reply 2 Retweet 2 Like 5","CinesArgentinos","@cinesargentinos ","2019-10-05",2,5,2,".Dejá tu crítica de #Joker en https://www.cinesargentinos.com.ar/pelicula/7938-guason/ …  #Guasón","#Joker, #Guasón","","Dejá, Joker, Guasón","2019-10-05"
"Mariano Riva Palacio Verified account  @JMRivaPalacio 3h 3 hours ago More ¡Intensa, hilarante y perturbadora! Sin duda una de las mejores películas del año @jokermovie (GUASÓN) y Joaquin Phoenix directo a las nominaciones.  Reply 3 Retweet 4 Like 29","Mariano Riva Palacio Verified account  ","@JMRivaPalacio ","2019-10-05",4,29,3,"¡Intensa, hilarante y perturbadora! Sin duda una de las mejores películas del año @jokermovie (GUASÓN) y Joaquin Phoenix directo a las nominaciones.","","@jokermovie","Intensa, Sin, GUASÓN, Joaquin, Phoenix","2019-10-05"
"Dai  🌟  @MissNegritu 2h 2 hours ago More Parezco buena madre pero estoy con mis hijas quiero ir a ver el Guason y tiene restricción de edad...  Las dejaré en el apartamento fingiendo migraña y me devuelvo. Reply 4 Retweet 2 Like 36","Dai  ","@MissNegritu ","2019-10-05",2,36,4,"🌟Parezco buena madre pero estoy con mis hijas quiero ir a ver el Guason y tiene restricción de edad...  Las dejaré en el apartamento fingiendo migraña y me devuelvo.","","","Parezco, Guason, Las","2019-10-05"
"Playboy Colombia Verified account  @playboy_col 3h 3 hours ago More #Cine| Sin spoilers hacemos un análisis de esta película violenta, oscura y deprimente que habla sobre la soledad y el aislamiento social http://bit.ly/2nUadny  Reply Retweet 1 Like 5","Playboy Colombia Verified account  ","@playboy_col ","2019-10-05",1,5,NA,"#Cine| Sin spoilers hacemos un análisis de esta película violenta, oscura y deprimente que habla sobre la soledad y el aislamiento social http://bit.ly/2nUadny","#Cine","","Cine, Sin, Uadny","2019-10-05"
"Max Julio Flores  @maxjflores 3h 3 hours ago More Aquí los actores que han interpretado al #Joker, pero cada quien tiene a su favorito.  Quien no haya visto el trabajo de cada uno no puede decir que Joaquín es el mejor... César Romero, Jack Nicholson, Heath Ledger, Jared Leto y Joaquin Phoenix ¿Cuál #Guason es el tuyo?  Reply 2 Retweet Like 8","Max Julio Flores  ","@maxjflores ","2019-10-05",NA,8,2,"Aquí los actores que han interpretado al #Joker, pero cada quien tiene a su favorito.  Quien no haya visto el trabajo de cada uno no puede decir que Joaquín es el mejor... César Romero, Jack Nicholson, Heath Ledger, Jared Leto y Joaquin Phoenix ¿Cuál #Guason es el tuyo?","#Joker, #Guason","","Aquí, Joker, Quien, Joaquín, César, Romero, Jack, Nicholson, Heath, Ledger, Jared, Leto, Joaquin, Phoenix, Cuál, Guason","2019-10-05"
"Luis Bonilla-Molina  @Luis_Bonilla_M 2h 2 hours ago More La película El #Guason trabaja una imagen violenta del conflicto social,colocando en un segundo plano las injusticias y desigualdades;es decir la violencia estructural del sistema.Dado lo taquillero del filme los educadores debemos analizarla en las aulas con #pedadogia #crítica Reply 1 Retweet 3 Like 3","Luis Bonilla","@Luis_Bonilla_M ","2019-10-05",3,3,1,"-La película El #Guason trabaja una imagen violenta del conflicto social,colocando en un segundo plano las injusticias y desigualdades;es decir la violencia estructural del sistema.Dado lo taquillero del filme los educadores debemos analizarla en las aulas con #pedadogia #crítica","#Guason, #pedadogia, #crítica","","La, El, Guason, Dado","2019-10-05"
"Señora Clau.  @claudiaagaray 20m 20 minutes ago More Saben? Fui a ver Joker o Guason y quede literalmente mal. Tremenda actuación de #JoaquinPhoenix Reply 5 Retweet 2 Like 21","Señora Clau","@claudiaagaray ","2019-10-05",2,21,5,".Saben? Fui a ver Joker o Guason y quede literalmente mal. Tremenda actuación de #JoaquinPhoenix","#JoaquinPhoenix","","Saben, Fui, Joker, Guason, Tremenda, JoaquinPhoenix","2019-10-05"
"Alvaro Rondon  @AlvaroRondon17 2h 2 hours ago More #GuasonGuaido este si puede ser, pero nunca como el guasón  Reply Retweet 4 Like 2","Alvaro Rondon  ","@AlvaroRondon17 ","2019-10-05",4,2,NA,"#GuasonGuaido este si puede ser, pero nunca como el guasón","#GuasonGuaido","","GuasonGuaido","2019-10-05"
"viva venezuela  @mariayaneth2025 2h 2 hours ago More #GuasonGuaido  quien sera el próximo guason que salga Reply 1 Retweet 7 Like 5","viva venezuela  ","@mariayaneth2025 ","2019-10-05",7,5,1,"#GuasonGuaido  quien sera el próximo guason que salga","#GuasonGuaido","","GuasonGuaido","2019-10-05"
"Novela Gráfica  @_NovelaGrafica 2h 2 hours ago More ¡Nueva reseña! Ya pueden encontrar en nuestro canal de YouTube nuestra opinión sobre Joker, Guasón, El Bromas, Etc.  Es impensable la calidad que alcanzaron Todd Phillips y Joaquin Phoenix con esta película.   https://youtu.be/f68GPh6xVCY   #Joker #Guasón  Reply 3 Retweet 6 Like 7","Novela Gráfica  ","@_NovelaGrafica ","2019-10-05",6,7,3,"¡Nueva reseña! Ya pueden encontrar en nuestro canal de YouTube nuestra opinión sobre Joker, Guasón, El Bromas, Etc.  Es impensable la calidad que alcanzaron Todd Phillips y Joaquin Phoenix con esta película.   https://youtu.be/f68GPh6xVCY   #Joker #Guasón","#Joker, #Guasón","","Nueva, Ya, YouTube, Joker, Guasón, El, Bromas, Etc, Es, Todd, Phillips, Joaquin, Phoenix, GPh6xVCY, Joker, Guasón","2019-10-05"
"Xgamer  @Xgamer32384933 2h 2 hours ago More El tipo tiene la misma maldad del guasón! Solo quiere destruir #GuasonGuaido Reply Retweet 3 Like 3","Xgamer  ","@Xgamer32384933 ","2019-10-05",3,3,NA,"El tipo tiene la misma maldad del guasón! Solo quiere destruir #GuasonGuaido","#GuasonGuaido","","El, Solo, GuasonGuaido","2019-10-05"
"AdriancitoElniñomabonito  @Miguel_GG21 3h 3 hours ago More Ya quiero ir a ver el Guasón Reply 2 Retweet Like 1","AdriancitoElniñomabonito  ","@Miguel_GG21 ","2019-10-05",NA,1,2,"Ya quiero ir a ver el Guasón","","","Ya, Guasón","2019-10-05"
"Gerard  ♨️  @0808Gerard 2h 2 hours ago More #Guason pobres tontos  pic.twitter.com/87ghdSEFz3 This media may contain sensitive material. Learn more View Reply Retweet 1 Like 2","Gerard  ","@0808Gerard ","2019-10-05",1,2,NA,"♨#Guason pobres tontos  pic.twitter.com/87ghdSEFz3 This media may contain sensitive material. Learn more View","#Guason","","Guason, SEFz3, This, Learn, View","2019-10-05"
