"value","nombre","usuario","fecha","retweets","like","replies","texto","hashtags","ctasMencionadas","nombres_propios","fecha2"
"Lidia Coria  @liXoria Oct 3 More No me puedo sacar de la cabeza la paleta de colores, la luz y toda la cinematografía de #Joker. ¿Se puede filmar tan hermoso? Enamorada estoy. #JokerMovie #Guason  Reply Retweet Like 1","Lidia Coria  ","@liXoria "," Oct 3 ",NA,1,NA,"No me puedo sacar de la cabeza la paleta de colores, la luz y toda la cinematografía de #Joker. ¿Se puede filmar tan hermoso? Enamorada estoy. #JokerMovie #Guason","#Joker, #JokerMovie, #Guason","","No, Joker, Se, Enamorada, JokerMovie, Guason","2019-10-03"
"Museo De Chucky  @MuseoDeChucky Oct 3 More En algunos cines se está prohibiendo el acceso a quienes vayan disfrazados a ver la película del Joker. Consulta a tu cine antes de disfrazarte.  http://instagram.com/MuseoDeChucky  #Joker #Guason #JokerMovie  Reply Retweet Like 3","Museo De Chucky  ","@MuseoDeChucky "," Oct 3 ",NA,3,NA,"En algunos cines se está prohibiendo el acceso a quienes vayan disfrazados a ver la película del Joker. Consulta a tu cine antes de disfrazarte.  http://instagram.com/MuseoDeChucky  #Joker #Guason #JokerMovie","#Joker, #Guason, #JokerMovie","","En, Joker, Consulta, MuseoDeChucky, Joker, Guason, JokerMovie","2019-10-03"
"miCartelera.com.ar  @miCartelera Oct 3 More Guasón  Gran estreno    A H O R A  E N  C I N E S #Guason  #JokerMovie #Joker  Reply Retweet 2 Like 5","miCartelera","@miCartelera "," Oct 3 ",2,5,NA,".com.Guasón  Gran estreno    A H O R A  E N  C I N E S #Guason  #JokerMovie #Joker","#Guason, #JokerMovie, #Joker","","Guasón, Gran, Guason, JokerMovie, Joker","2019-10-03"
"GuilleMancandy  @guillemancandy Oct 3 More #BuenJueves TwitterGuasones #FelizJueves JokerTweens  entren a http://Instagram.Com/Guillemancandy  y conozcan al PAYASO PORQUERIA inspirado en #Joker #Guason #JokerMovie @jokermovie #SeguimeYTeSigo #SeguimeYTeSigoArgentina #SiguemeYTeSigo #JuevesDeGanarSeguidores #QuintaDetremuraSDV Reply Retweet 2 Like 22","GuilleMancandy  ","@guillemancandy "," Oct 3 ",2,22,NA,"#BuenJueves TwitterGuasones #FelizJueves JokerTweens  entren a http://Instagram.Com/Guillemancandy  y conozcan al PAYASO PORQUERIA inspirado en #Joker #Guason #JokerMovie @jokermovie #SeguimeYTeSigo #SeguimeYTeSigoArgentina #SiguemeYTeSigo #JuevesDeGanarSeguidores #QuintaDetremuraSDV","#BuenJueves, #FelizJueves, #Joker, #Guason, #JokerMovie, #SeguimeYTeSigo, #SeguimeYTeSigoArgentina, #SiguemeYTeSigo, #JuevesDeGanarSeguidores, #QuintaDetremuraSDV","@jokermovie","BuenJueves, TwitterGuasones, FelizJueves, JokerTweens, Instagram, Com, Guillemancandy, PAYASO, PORQUERIA, Joker, Guason, JokerMovie, SeguimeYTeSigo, SeguimeYTeSigoArgentina, SiguemeYTeSigo, JuevesDeGanarSeguidores, QuintaDetremuraSDV","2019-10-03"
"Edison Zapata  @EdisonZapata23 Oct 3 More #Guason está de regreso #JokerMovie  #Joker  Reply Retweet Like","Edison Zapata  ","@EdisonZapata23 "," Oct 3 ",NA,NA,NA,"#Guason está de regreso #JokerMovie  #Joker","#Guason, #JokerMovie, #Joker","","Guason, JokerMovie, Joker","2019-10-03"
"Alex AGS  @LEXGeovanny Oct 3 More Y vamos de nuevo... #Guason #Joker #JokerMovie  Reply Retweet Like","Alex AGS  ","@LEXGeovanny "," Oct 3 ",NA,NA,NA,"Y vamos de nuevo... #Guason #Joker #JokerMovie","#Guason, #Joker, #JokerMovie","","Guason, Joker, JokerMovie","2019-10-03"
"Guasón #NowPlaying  @EnCines_SV Oct 3 More ""¿Cuáles son las implicaciones de la violencia en el mundo real?"" #ToddPhillips, director. #JuevesDeEstreno único #EnCines #ElSalvador... #JoaquinPhoenix #Guasón #Joker (2019) #RobertDeNiro #FrancesConroy #ZazieBeetz  @jokermovie @WBPicturesLatam Reply Retweet Like 1","Guasón ","@EnCines_SV "," Oct 3 ",NA,1,NA,"#""¿Cuáles son las implicaciones de la violencia en el mundo real?"" #ToddPhillips, director. #JuevesDeEstreno único #EnCines #ElSalvador... #JoaquinPhoenix #Guasón #Joker (2019) #RobertDeNiro #FrancesConroy #ZazieBeetz  @jokermovie @WBPicturesLatam","#ToddPhillips, #JuevesDeEstreno, #EnCines, #ElSalvador, #JoaquinPhoenix, #Guasón, #Joker, #RobertDeNiro, #FrancesConroy, #ZazieBeetz","@jokermovie, @WBPicturesLatam","Cuáles, ToddPhillips, JuevesDeEstreno, EnCines, ElSalvador, JoaquinPhoenix, Guasón, Joker, RobertDeNiro, FrancesConroy, ZazieBeetz","2019-10-03"
"EL NORTE Verified account  @elnorte Oct 3 More Finalmente @jokermovie, una de las cintas que dará de qué hablar rumbo al #Óscar, llega a los cines de México, en el primer minuto del viernes. Reply Retweet Like 8","EL NORTE Verified account  ","@elnorte "," Oct 3 ",NA,8,NA,"Finalmente @jokermovie, una de las cintas que dará de qué hablar rumbo al #Óscar, llega a los cines de México, en el primer minuto del viernes.","#Óscar","@jokermovie","Finalmente, México","2019-10-03"
"Positive Diva ©  @positive_diva Oct 3 More Ya esta mi comentario de #joker #guason que se presenta hoy en #cine @WarnerBrosChile @jokermovie @wbpictures #positivediva encuentralo en #youtube Reply Retweet Like 1","Positive Diva ","@positive_diva "," Oct 3 ",NA,1,NA,"©Ya esta mi comentario de #joker #guason que se presenta hoy en #cine @WarnerBrosChile @jokermovie @wbpictures #positivediva encuentralo en #youtube","#joker, #guason, #cine, #positivediva, #youtube","@WarnerBrosChile, @jokermovie, @wbpictures","Ya","2019-10-03"
"Alex Fernando   💪  🏀  🤷‍♂️  🇵🇪  🌍  @unlococalato02 Oct 3 More Lo que más me dio pena, es que no se haya comido a la morena. #Guasón #Joker #JokerMovie  Reply 2 Retweet Like 13 Show this thread","Alex Fernando   ","@unlococalato02 "," Oct 3 ",NA,13,2,"💪  🏀  🤷‍♂️  🇵🇪  🌍Lo que más me dio pena, es que no se haya comido a la morena. #Guasón #Joker #JokerMovie     Show this thread","#Guasón, #Joker, #JokerMovie","","Lo, Guasón, Joker, JokerMovie, Show","2019-10-03"
"AP Verified account  @altapeli Oct 3 More ¿Una de las mejores películas del año? Joaquin Phoenix y Todd Phillips tienen toda nuestra atención. REVIEW de #Joker #JokerMovie #Guason  Reply Retweet 5 Like 21","AP Verified account  ","@altapeli "," Oct 3 ",5,21,NA,"¿Una de las mejores películas del año? Joaquin Phoenix y Todd Phillips tienen toda nuestra atención. REVIEW de #Joker #JokerMovie #Guason","#Joker, #JokerMovie, #Guason","","Una, Joaquin, Phoenix, Todd, Phillips, REVIEW, Joker, JokerMovie, Guason","2019-10-03"
"GuilleMancandy  @guillemancandy Oct 3 More Joker podra #JoaquinPhoenix superar a #HeathLedger ? Sera nominado a los #Oscars2020 ? Antes de ir al cine recomiendo q vean este CLASICO de #Scorsese ""El Rey De La Comedia"" (1982) con #RobertDeNiro y Jerry Lewis, GRAN influencia para filmar #Joker #Guason #JokerMovie   Reply Retweet 3 Like 21","GuilleMancandy  ","@guillemancandy "," Oct 3 ",3,21,NA,"Joker podra #JoaquinPhoenix superar a #HeathLedger ? Sera nominado a los #Oscars2020 ? Antes de ir al cine recomiendo q vean este CLASICO de #Scorsese ""El Rey De La Comedia"" (1982) con #RobertDeNiro y Jerry Lewis, GRAN influencia para filmar #Joker #Guason #JokerMovie","#JoaquinPhoenix, #HeathLedger, #Oscars2020, #Scorsese, #RobertDeNiro, #Joker, #Guason, #JokerMovie","","Joker, JoaquinPhoenix, HeathLedger, Sera, Oscars2020, Antes, CLASICO, Scorsese, El, Rey, De, La, Comedia, RobertDeNiro, Jerry, Lewis, GRAN, Joker, Guason, JokerMovie","2019-10-03"
"CandeB12  @Cande_B12 Oct 3 More Tampoco se de actuación, pero cuando un actor te transmite por completo el mensaje que quiere dar, es para aplaudir. Una película que vale la pena ver mas de una vez.  #JokerMovie #Joker #Guason  Reply Retweet Like 1 Show this thread","CandeB12  ","@Cande_B12 "," Oct 3 ",NA,1,NA,"Tampoco se de actuación, pero cuando un actor te transmite por completo el mensaje que quiere dar, es para aplaudir. Una película que vale la pena ver mas de una vez.  #JokerMovie #Joker #Guason     Show this thread","#JokerMovie, #Joker, #Guason","","Tampoco, Una, JokerMovie, Joker, Guason, Show","2019-10-03"
"#FuturoPSP  @pspfuturofm Oct 3 More  Hablamos de @jokermovie junto a @LetelierJorge. Hoy, te preguntamos: ¿Cuál crees que es el mejor ""guasón""? Reply 6 Retweet Like 1",NA,"@pspfuturofm "," Oct 3 ",NA,1,6,"# Hablamos de @jokermovie junto a @LetelierJorge. Hoy, te preguntamos: ¿Cuál crees que es el mejor ""guasón""?","","@jokermovie, @LetelierJorge","Hablamos, Hoy, Cuál","2019-10-03"
"Leo  @Leonardo_Abog Oct 3 More #3Oct El nuevo Guason #Joker  (con #JoaquinPhoenix )el villano más temible que se haya enfrentado  se estrena hoy #JokerMovie #FelizJueves Reply Retweet Like","Leo  ","@Leonardo_Abog "," Oct 3 ",NA,NA,NA,"#3Oct El nuevo Guason #Joker  (con #JoaquinPhoenix )el villano más temible que se haya enfrentado  se estrena hoy #JokerMovie #FelizJueves","#3Oct, #Joker, #JoaquinPhoenix, #JokerMovie, #FelizJueves","","Oct, El, Guason, Joker, JoaquinPhoenix, JokerMovie, FelizJueves","2019-10-03"
"yorchchurch5  @yorchchurch5 Oct 3 More El Joker. #jokermovie #joker #joaquinphoenix #joaquinphoenixjoker  #guason #art #fineart #sketch_dailydose  #scribble #scribbles #enredosdeiglesias #enredosiglesias pic.twitter.com/CFmLAj0S9f This media may contain sensitive material. Learn more View Reply Retweet 2 Like 4","yorchchurch5  ","@yorchchurch5 "," Oct 3 ",2,4,NA,"El Joker. #jokermovie #joker #joaquinphoenix #joaquinphoenixjoker  #guason #art #fineart #sketch_dailydose  #scribble #scribbles #enredosdeiglesias #enredosiglesias pic.twitter.com/CFmLAj0S9f This media may contain sensitive material. Learn more View","#jokermovie, #joker, #joaquinphoenix, #joaquinphoenixjoker, #guason, #art, #fineart, #sketch_dailydose, #scribble, #scribbles, #enredosdeiglesias, #enredosiglesias","","El, Joker, CFmLAj0S9f, This, Learn, View","2019-10-03"
"Página|12 Verified account  @pagina12 Oct 3 More Por qué no te podés perder ver @jokermovie | Por Luciano Monteagudo  Reply Retweet 5 Like 12","Página","@pagina12 "," Oct 3 ",5,12,NA,"|Por qué no te podés perder ver @jokermovie | Por Luciano Monteagudo","","@jokermovie","Por, Por, Luciano, Monteagudo","2019-10-03"
"Estrelladas TV  @EstrelladasTV Oct 3 More REVIEW de #Joker por @ourseyesopen en @EstrelladasTV   https://www.estrelladastv.com.ar/estrenos-de-cine-guason/ … #JokerMovie #Guason Reply Retweet Like","Estrelladas TV  ","@EstrelladasTV "," Oct 3 ",NA,NA,NA,"REVIEW de #Joker por @ourseyesopen en @EstrelladasTV   https://www.estrelladastv.com.ar/estrenos-de-cine-guason/ … #JokerMovie #Guason","#Joker, #JokerMovie, #Guason","@ourseyesopen, @EstrelladasTV","REVIEW, Joker, JokerMovie, Guason","2019-10-03"
"La Mascarada  @La_Mascarada Oct 3 More Hoy se estrena #JokerMovie, ¿será mejor versión del personaje que ésta?  http://lamascarada.com.mx/2016/12/11/mad-love-la-mejor-encarnacion-the-joker/ … #Film #Joker #Cine #Cinema #Comic #Estreno #Guasón #DC Reply Retweet 1 Like 1","La Mascarada  ","@La_Mascarada "," Oct 3 ",1,1,NA,"Hoy se estrena #JokerMovie, ¿será mejor versión del personaje que ésta?  http://lamascarada.com.mx/2016/12/11/mad-love-la-mejor-encarnacion-the-joker/ … #Film #Joker #Cine #Cinema #Comic #Estreno #Guasón #DC","#JokerMovie, #Film, #Joker, #Cine, #Cinema, #Comic, #Estreno, #Guasón, #DC","","Hoy, JokerMovie, Film, Joker, Cine, Cinema, Comic, Estreno, Guasón, DC","2019-10-03"
"Toysman  @toysmanoficial Oct 3 More #STOCK #WeAreAllClowns > Hoy se estrena el #Joker y tenemos en la #ToysmanCueva estas brutales gorras viseras en vinilo flock!  600 (efectivo/deposito ) 700 (mercadopago)  #JokerMovie  #BuenJueves  #Guason  – at Toysman - Showroom Reply Retweet Like 2","Toysman  ","@toysmanoficial "," Oct 3 ",NA,2,NA,"#STOCK #WeAreAllClowns > Hoy se estrena el #Joker y tenemos en la #ToysmanCueva estas brutales gorras viseras en vinilo flock!  600 (efectivo/deposito ) 700 (mercadopago)  #JokerMovie  #BuenJueves  #Guason  – at Toysman - Showroom","#STOCK, #WeAreAllClowns, #Joker, #ToysmanCueva, #JokerMovie, #BuenJueves, #Guason","","STOCK, WeAreAllClowns, Hoy, Joker, ToysmanCueva, JokerMovie, BuenJueves, Guason, Toysman, Showroom","2019-10-03"
"Diario EL SOL  @elsolquilmes Oct 3 More La autocrítica de Joaquin Phoenix por su papel en el Guasón: “Una parte de mi trabajo no funcionaba” #JoaquinPhoenix #JokerMovie #Joker #Guason  https://elsolnoticias.com.ar/la-autocritica-de-joaquin-phoenix-por-su-papel-en-el-guason-una-parte-de-mi-trabajo-no-funcionaba/ … Reply Retweet Like 1","Diario EL SOL  ","@elsolquilmes "," Oct 3 ",NA,1,NA,"La autocrítica de Joaquin Phoenix por su papel en el Guasón: “Una parte de mi trabajo no funcionaba” #JoaquinPhoenix #JokerMovie #Joker #Guason  https://elsolnoticias.com.ar/la-autocritica-de-joaquin-phoenix-por-su-papel-en-el-guason-una-parte-de-mi-trabajo-no-funcionaba/ …","#JoaquinPhoenix, #JokerMovie, #Joker, #Guason","","La, Joaquin, Phoenix, Guasón, Una, JoaquinPhoenix, JokerMovie, Joker, Guason","2019-10-03"
"Guasón #NowPlaying  @EnCines_SV Oct 3 More #JuevesDeEstreno #EnCines #ElSalvador y #Argentina... #JoaquinPhoenix es #Guasón #Joker (2019) #RobertDeNiro #FrancesConroy #ZazieBeetz  Dirigida por #ToddPhillips  @jokermovie @WBPicturesLatam Reply Retweet 3 Like 1","Guasón ","@EnCines_SV "," Oct 3 ",3,1,NA,"##JuevesDeEstreno #EnCines #ElSalvador y #Argentina... #JoaquinPhoenix es #Guasón #Joker (2019) #RobertDeNiro #FrancesConroy #ZazieBeetz  Dirigida por #ToddPhillips  @jokermovie @WBPicturesLatam","#JuevesDeEstreno, #EnCines, #ElSalvador, #Argentina, #JoaquinPhoenix, #Guasón, #Joker, #RobertDeNiro, #FrancesConroy, #ZazieBeetz, #ToddPhillips","@jokermovie, @WBPicturesLatam","JuevesDeEstreno, EnCines, ElSalvador, Argentina, JoaquinPhoenix, Guasón, Joker, RobertDeNiro, FrancesConroy, ZazieBeetz, Dirigida, ToddPhillips","2019-10-03"
"Cuanto Vale un Euro  @cuantovale1euro Oct 3 More En dos días se estrena #Joker, el ""guasón"". Una personalidad completamente fuera de control en búsqueda de la anarquía y la autodestrucción. ¿Sabes lo que no tiene ninguna gracia? Que pierdas el control de tu empresa. Recupéralo en https://buff.ly/2MqfzBx   #JokerMovie  Reply Retweet Like","Cuanto Vale un Euro  ","@cuantovale1euro "," Oct 3 ",NA,NA,NA,"En dos días se estrena #Joker, el ""guasón"". Una personalidad completamente fuera de control en búsqueda de la anarquía y la autodestrucción. ¿Sabes lo que no tiene ninguna gracia? Que pierdas el control de tu empresa. Recupéralo en https://buff.ly/2MqfzBx   #JokerMovie","#Joker, #JokerMovie","","En, Joker, Una, Sabes, Que, Recupéralo, MqfzBx, JokerMovie","2019-10-03"
"Gustavo  @gusracingclub Oct 3 More Y llegó el día, hoy en los cines más importantes de Argentina llega la película de Todd Phillips, Guasón interpretado por el gran Joaquin Phoenix. Joker nos lleva a descubrir el origen del némesis de Batman, cuando este aún no existía... #Joker #JokerMovie #Guasón  Reply Retweet Like 1","Gustavo  ","@gusracingclub "," Oct 3 ",NA,1,NA,"Y llegó el día, hoy en los cines más importantes de Argentina llega la película de Todd Phillips, Guasón interpretado por el gran Joaquin Phoenix. Joker nos lleva a descubrir el origen del némesis de Batman, cuando este aún no existía... #Joker #JokerMovie #Guasón","#Joker, #JokerMovie, #Guasón","","Argentina, Todd, Phillips, Guasón, Joaquin, Phoenix, Joker, Batman, Joker, JokerMovie, Guasón","2019-10-03"
"Reforma Gente! Verified account  @reformagente Oct 3 More Finalmente @jokermovie, una de las cintas que dará de qué hablar rumbo al #Óscar, llega a los cines de México, en el primer minuto del viernes. Reply Retweet 14 Like 22","Reforma Gente","@reformagente "," Oct 3 ",14,22,NA,"!Finalmente @jokermovie, una de las cintas que dará de qué hablar rumbo al #Óscar, llega a los cines de México, en el primer minuto del viernes.","#Óscar","@jokermovie","Finalmente, México","2019-10-03"
"Ray Nilton  @RayNilton Oct 3 More Estreno Joker  Estreno Guasón  . . . #joker #jokers #guason #thejoker #jokermovie #elguason #movies #movie #cine #cinema #pelicula #peliculas #joaquinphoenix #estreno #premier #lima #peru #cineplanet Reply 1 Retweet Like","Ray Nilton  ","@RayNilton "," Oct 3 ",NA,NA,1,"Estreno Joker  Estreno Guasón  . . . #joker #jokers #guason #thejoker #jokermovie #elguason #movies #movie #cine #cinema #pelicula #peliculas #joaquinphoenix #estreno #premier #lima #peru #cineplanet","#joker, #jokers, #guason, #thejoker, #jokermovie, #elguason, #movies, #movie, #cine, #cinema, #pelicula, #peliculas, #joaquinphoenix, #estreno, #premier, #lima, #peru, #cineplanet","","Estreno, Joker, Estreno, Guasón","2019-10-03"
"The Criminal Post  @thecriminalpost Oct 3 More Acabo de salir de ver el #Joker (#Guasón). Vayan a verla. 100% recomendada. #JoaquinPhoenix brillante como siempre. Recuerden que si la ven, no spoileen a otras personas. Dejemos que todos vivan la experiencia de sorprenderse minuto a minuto.  Vayan al cine.  @jokermovie  Reply Retweet Like 1","The Criminal Post  ","@thecriminalpost "," Oct 3 ",NA,1,NA,"Acabo de salir de ver el #Joker (#Guasón). Vayan a verla. 100% recomendada. #JoaquinPhoenix brillante como siempre. Recuerden que si la ven, no spoileen a otras personas. Dejemos que todos vivan la experiencia de sorprenderse minuto a minuto.  Vayan al cine.  @jokermovie","#Joker, #Guasón, #JoaquinPhoenix","@jokermovie","Acabo, Joker, Guasón, Vayan, JoaquinPhoenix, Recuerden, Dejemos, Vayan","2019-10-03"
"Tribuna de San Luis  @TribunaSL Oct 3 More #Tribuna #Cine #JokerMovie Problemas mentales, el rechazo de la sociedad y un futuro incierto marcan el nacimiento de Guasón, personificado por Joaquin Phoenix, que indaga en lo más íntimo del enemigo más famoso de Ciudad Gótica Reply Retweet Like","Tribuna de San Luis  ","@TribunaSL "," Oct 3 ",NA,NA,NA,"#Tribuna #Cine #JokerMovie Problemas mentales, el rechazo de la sociedad y un futuro incierto marcan el nacimiento de Guasón, personificado por Joaquin Phoenix, que indaga en lo más íntimo del enemigo más famoso de Ciudad Gótica","#Tribuna, #Cine, #JokerMovie","","Tribuna, Cine, JokerMovie, Problemas, Guasón, Joaquin, Phoenix, Ciudad, Gótica","2019-10-03"
"CandeB12  @Cande_B12 Oct 3 More Acabo de ver Joker y la verdad quede fascinada, no puedo dar una critica profesional, pero puedo explicar lo que sentí con esta película sin hacer spoilers. Fue una mezcla de emociones, felicidad, tristeza, lastima, salí pensando en muchas cosas.  #JokerMovie #Joker #Guason Reply 1 Retweet Like 1 Show this thread","CandeB12  ","@Cande_B12 "," Oct 3 ",NA,1,1,"Acabo de ver Joker y la verdad quede fascinada, no puedo dar una critica profesional, pero puedo explicar lo que sentí con esta película sin hacer spoilers. Fue una mezcla de emociones, felicidad, tristeza, lastima, salí pensando en muchas cosas.  #JokerMovie #Joker #Guason    Show this thread","#JokerMovie, #Joker, #Guason","","Acabo, Joker, Fue, JokerMovie, Joker, Guason, Show","2019-10-03"
"Jesús Chavarria Verified account  @jchavarria_cine Oct 3 More Y en lo que se estrena #JokerMovie, en @TimeOutMexico les preparamos un breve recuento de actores que han interpretado al #Joker o #Guason, denle por aquí  Reply Retweet 5 Like 46","Jesús Chavarria Verified account  ","@jchavarria_cine "," Oct 3 ",5,46,NA,"Y en lo que se estrena #JokerMovie, en @TimeOutMexico les preparamos un breve recuento de actores que han interpretado al #Joker o #Guason, denle por aquí","#JokerMovie, #Joker, #Guason","@TimeOutMexico","JokerMovie, Joker, Guason","2019-10-03"
"josé ignacio  @IgnaFernandezz Oct 3 More Faltan menos de 2 horas para ver al #Guason  y ya estamos listos!!! @DaianaNahir21 @WBPictures_Ar #Joker #JokerMovie   Reply 1 Retweet Like 2","josé ignacio  ","@IgnaFernandezz "," Oct 3 ",NA,2,1,"Faltan menos de 2 horas para ver al #Guason  y ya estamos listos!!! @DaianaNahir21 @WBPictures_Ar #Joker #JokerMovie","#Guason, #Joker, #JokerMovie","@DaianaNahir21, @WBPictures_Ar","Faltan, Guason, Joker, JokerMovie","2019-10-03"
"#CróticasDeCine  @Absurdismos Oct 3 More Los esperamos a las 5 pm en @radio102nueve   #CróticasDeCine @ElMundoSV @CarmenLemus1  #joker #guason #@jokermovie #eljoker #elguason #elguasón Reply Retweet Like",NA,"@Absurdismos "," Oct 3 ",NA,NA,NA,"#Los esperamos a las 5 pm en @radio102nueve   #CróticasDeCine @ElMundoSV @CarmenLemus1  #joker #guason #@jokermovie #eljoker #elguason #elguasón","#Los, #CróticasDeCine, #joker, #guason, #eljoker, #elguason, #elguasón","@radio102nueve, @ElMundoSV, @CarmenLemus1, @jokermovie","Los, CróticasDeCine","2019-10-03"
"#CróticasDeCine  @Absurdismos Oct 3 More Cine con el Crítico más Crítico @radio102nueve   Hoy jueves 5:00pm en #EsperandoLaNoche junto a @JackyMoralesA y @DGalvezTCS  #JokerMovie #joker #Guason #guason #thejoker #JoaquinPhoenix #peliculas @jokermovie #cine #dramafilms  #ToddPhillips Reply Retweet Like 2",NA,"@Absurdismos "," Oct 3 ",NA,2,NA,"#Cine con el Crítico más Crítico @radio102nueve   Hoy jueves 5:00pm en #EsperandoLaNoche junto a @JackyMoralesA y @DGalvezTCS  #JokerMovie #joker #Guason #guason #thejoker #JoaquinPhoenix #peliculas @jokermovie #cine #dramafilms  #ToddPhillips","#Cine, #EsperandoLaNoche, #JokerMovie, #joker, #Guason, #guason, #thejoker, #JoaquinPhoenix, #peliculas, #cine, #dramafilms, #ToddPhillips","@radio102nueve, @JackyMoralesA, @DGalvezTCS, @jokermovie","Cine, Crítico, Crítico, Hoy, EsperandoLaNoche, JokerMovie, Guason, JoaquinPhoenix, ToddPhillips","2019-10-03"
"Steven Andrés.M   📝  📷  📚  @StAn_PHAr Oct 3 More Qué depresión tan hpta que da la de tener ganas de ir  Cine a ver  La peli del GUASON.. Y no tener con quién y ni plata tampoco.  Jsjsjs #Joker #JokerConRadioacktiva #JokerMovie Reply Retweet Like 2","Steven Andrés","@StAn_PHAr "," Oct 3 ",NA,2,NA,".M   📝  📷  📚Qué depresión tan hpta que da la de tener ganas de ir  Cine a ver  La peli del GUASON.. Y no tener con quién y ni plata tampoco.  Jsjsjs #Joker #JokerConRadioacktiva #JokerMovie","#Joker, #JokerConRadioacktiva, #JokerMovie","","Qué, Cine, La, GUASON, Jsjsjs, Joker, JokerConRadioacktiva, JokerMovie","2019-10-03"
"Metacultura  @metacultura Oct 3 More Cine - Estrenos - Guasón (Joker), de Todd Phillips (@jokermovie/ #Guasón/ #Joker/ #JokerMovie/ #ToddPhillips/ #JoaquinPhoenix/ #Batman) - La risa que duele - Por Emiliano Fernández http://metacultura.com.ar/la-risa-que-duele/ … Reply Retweet Like 2","Metacultura  ","@metacultura "," Oct 3 ",NA,2,NA,"Cine - Estrenos - Guasón (Joker), de Todd Phillips (@jokermovie/ #Guasón/ #Joker/ #JokerMovie/ #ToddPhillips/ #JoaquinPhoenix/ #Batman) - La risa que duele - Por Emiliano Fernández http://metacultura.com.ar/la-risa-que-duele/ …","#Guasón, #Joker, #JokerMovie, #ToddPhillips, #JoaquinPhoenix, #Batman","@jokermovie","Cine, Estrenos, Guasón, Joker, Todd, Phillips, Guasón, Joker, JokerMovie, ToddPhillips, JoaquinPhoenix, Batman, La, Por, Emiliano, Fernández","2019-10-03"
"Elian Aguilar  @eaguilar2010 Oct 3 More Hoy estrena #Joker o #Guason y si quieren ver como hacer una mala entrevista, miren esto:  https://youtu.be/tZNBy-BdM2A   #JokerMovie Reply 1 Retweet Like","Elian Aguilar  ","@eaguilar2010 "," Oct 3 ",NA,NA,1,"Hoy estrena #Joker o #Guason y si quieren ver como hacer una mala entrevista, miren esto:  https://youtu.be/tZNBy-BdM2A   #JokerMovie","#Joker, #Guason, #JokerMovie","","Hoy, Joker, Guason, ZNBy, BdM2A, JokerMovie","2019-10-03"
"Waldini  @Waldini24 Oct 3 More Buen día para todos. Ya estamos a 1 día del estreno de la tan esperada película #Guason  #JokerMovie  #Joker  #guason  Reply Retweet Like 1","Waldini  ","@Waldini24 "," Oct 3 ",NA,1,NA,"Buen día para todos. Ya estamos a 1 día del estreno de la tan esperada película #Guason  #JokerMovie  #Joker  #guason","#Guason, #JokerMovie, #Joker, #guason","","Buen, Ya, Guason, JokerMovie, Joker","2019-10-03"
"Nerdix  @NerdixCL Oct 3 More [CINE] @jokermovie o ""GUASÓN"" ya está en cines y la crítica de @soy_cinestro ya esta en @NerdixCL Reply Retweet 1 Like 2","Nerdix  ","@NerdixCL "," Oct 3 ",1,2,NA,"[CINE] @jokermovie o ""GUASÓN"" ya está en cines y la crítica de @soy_cinestro ya esta en @NerdixCL","","@jokermovie, @soy_cinestro, @NerdixCL","CINE, GUASÓN","2019-10-03"
"Celso Guerrero  @celsoguerrero Oct 3 More #Estreno hoy en cines RD: ""Guasón"" (Joker). Drama/Thriller. ""Explorará los orígenes del personaje, mostrando la historia de un hombre derribado por la sociedad que se convierte en el hombre que conocemos como el Joker."" Trailer: https://www.youtube.com/watch?v=TobNCFMK_bs … #JokerMovie #Guason  Reply Retweet Like 1","Celso Guerrero  ","@celsoguerrero "," Oct 3 ",NA,1,NA,"#Estreno hoy en cines RD: ""Guasón"" (Joker). Drama/Thriller. ""Explorará los orígenes del personaje, mostrando la historia de un hombre derribado por la sociedad que se convierte en el hombre que conocemos como el Joker."" Trailer: https://www.youtube.com/watch?v=TobNCFMK_bs … #JokerMovie #Guason","#Estreno, #JokerMovie, #Guason","","Estreno, RD, Guasón, Joker, Drama, Thriller, Explorará, Joker, Trailer, TobNCFMK_bs, JokerMovie, Guason","2019-10-03"
"elnorte_gente Verified account  @elnorte_gente Oct 3 More Finalmente @jokermovie, una de las cintas que dará de qué hablar rumbo al #Óscar, llega a los cines de México, en el primer minuto del viernes. Reply Retweet Like","elnorte_gente Verified account  ","@elnorte_gente "," Oct 3 ",NA,NA,NA,"Finalmente @jokermovie, una de las cintas que dará de qué hablar rumbo al #Óscar, llega a los cines de México, en el primer minuto del viernes.","#Óscar","@jokermovie","Finalmente, México","2019-10-03"
